{"assumptions":["Los argumentos del agente no acreditan autoría humana aunque W1 los marque human_explicit.","Paseo de referencia 50 m/min + 120 s por enlace completo y sentido."],"capability_id":"plan_visit","claims":[],"effective_request":{"contracts":{"capability":"1.1.0","evidence":"1.1.0","mobility":"0.3.1"},"defaults_applied":["arrival_margin_minutes","boarding_margin_minutes","return_deadline","snapshot_id","timezone","walking_profile_id"],"effective_period":"2026-09-30","municipality_codes":[],"municipality_labels":[],"operation":"plan_visit","parameters":{"appointment_time":"09:30:00","arrival_margin_minutes":10,"boarding_margin_minutes":3,"date":"2026-09-30","destination_id":"beasain_official_centre_anchor","duration_minutes":30,"origin_id":"zegama_center_stops","return_deadline":null,"snapshot_id":"official-goierrialdea-go01-health-r5-20260929","timezone":"Europe/Madrid","walking_profile_id":"poc_reference_50m_min_plus_120s"},"snapshot_id":"official-goierrialdea-go01-health-r5-20260929"},"error":{"available_options":[],"code":"date_not_validated","message":"Fecha no validada","origin":"data","safe_next_action":"Revise el catálogo, parámetros y fecha validada; este estado no prueba ausencia de transporte."},"execution":{"arguments_sha256":"408b4d2510dcd74519f4cbdb198739d7125b5b74081ae6c266570ee49acd6ffd","request_id":"OFFLINE_W2_R10_08","snapshot_id":"official-goierrialdea-go01-health-r5-20260929","state":"completed","tool":"plan_visit"},"limitations":["Entrada física NOT_VERIFIED; conflicto Bernedo Enea 1 / Zaldizurreta 2 pendiente de revisión humana.","GTFS estático y tiempos timepoint=0 aproximados; no realtime, domicilio, cita ni accesibilidad garantizada."],"method":"W1 0.3.1: pares GO01 programados y paseo modelado hasta punto oficial del centro; validación W2 de identidad, parámetros y componentes.","normalized_input":{"arguments":{"appointment_time":"09:30","date":"2026-09-30","destination_id":"beasain_official_centre_anchor","duration_minutes":30,"origin_id":"zegama_center_stops"},"tool":"plan_visit"},"outcomes":[{"error":{"code":"date_not_validated","message":"Fecha no validada"},"index":0,"status":"unknown"}],"raw_result_json":"{\"assumptions\":[\"50 m/min y 120 s por enlace completo y sentido; hipótesis no específica por edad.\",\"Solo GO01 directa; inicio y fin en paradas, no en domicilio.\"],\"components\":null,\"components_s\":null,\"error\":{\"code\":\"date_not_validated\",\"message\":\"Fecha no validada\"},\"health_destination\":{\"address\":\"Bernedo Enea 1\",\"address_conflict\":\"conflicting_current_sources\",\"anchor_coordinates\":[43.04527740634045,-2.1977014177917447],\"anchor_kind\":\"official_centre_point\",\"centre_anchor\":\"CONFIRMED_OFFICIAL_POINT\",\"centre_id\":\"entityBC631DA5\",\"centre_identity\":\"CONFIRMED\",\"crs\":\"EPSG:4326\",\"door_to_door\":\"UNAVAILABLE\",\"entrance_verification\":\"NOT_VERIFIED\",\"entrance_verified\":false,\"human_review_required\":true,\"modelled_access\":true,\"modelled_network_access\":\"PASS\",\"name\":\"Ambulatorio de Beasain\",\"source_refs\":[\"HEALTH_REGISTRY\",\"HEALTH_PAGE\",\"PADI_2026\"],\"wording\":\"El paseo termina en un punto de referencia modelado del centro; no representa una puerta física verificada.\"},\"itinerary\":null,\"limitations\":[\"El paseo termina en un punto de referencia modelado del centro; no representa una puerta física verificada.\",\"No puerta-a-puerta, asignación sanitaria, cita disponible ni accesibilidad universal.\",\"Pendientes, cruces, barreras y condiciones temporales no incorporados al tiempo; validar en campo.\",\"Horarios GTFS aproximados programados, no información en tiempo real.\",\"Conflicto de dirección en listado PADI conservado; no se deduce traslado.\",\"Óptimo limitado a paradas y red admitidas; fuera del bbox no implica ausencia de conexión real.\"],\"normalized_request\":{\"appointment_time\":\"09:30:00\",\"arrival_margin_minutes\":10,\"boarding_margin_minutes\":3,\"date\":\"2026-09-30\",\"destination_id\":\"beasain_official_centre_anchor\",\"duration_minutes\":30,\"origin_id\":\"zegama_center_stops\",\"return_deadline\":null,\"snapshot_id\":\"official-goierrialdea-go01-health-r5-20260929\",\"timezone\":\"Europe/Madrid\",\"walking_profile_id\":\"poc_reference_50m_min_plus_120s\"},\"parameter_provenance\":[{\"field\":\"origin_id\",\"origin\":\"human_explicit\",\"source_ref\":\"USER\",\"value\":\"zegama_center_stops\"},{\"field\":\"destination_id\",\"origin\":\"human_explicit\",\"source_ref\":\"USER\",\"value\":\"beasain_official_centre_anchor\"},{\"field\":\"date\",\"origin\":\"human_explicit\",\"source_ref\":\"USER\",\"value\":\"2026-09-30\"},{\"field\":\"appointment_time\",\"origin\":\"human_explicit\",\"source_ref\":\"USER\",\"value\":\"09:30:00\"},{\"field\":\"duration_minutes\",\"origin\":\"human_explicit\",\"source_ref\":\"USER\",\"value\":30},{\"field\":\"arrival_margin_minutes\",\"origin\":\"model_default\",\"source_ref\":\"MODEL_DEFAULTS\",\"value\":10},{\"field\":\"boarding_margin_minutes\",\"origin\":\"model_default\",\"source_ref\":\"MODEL_DEFAULTS\",\"value\":3},{\"field\":\"walking_profile_id\",\"origin\":\"model_default\",\"source_ref\":\"MODEL_DEFAULTS\",\"value\":\"poc_reference_50m_min_plus_120s\"},{\"field\":\"snapshot_id\",\"origin\":\"model_default\",\"source_ref\":\"MODEL_DEFAULTS\",\"value\":\"official-goierrialdea-go01-health-r5-20260929\"},{\"field\":\"timezone\",\"origin\":\"model_default\",\"source_ref\":\"MODEL_DEFAULTS\",\"value\":\"Europe/Madrid\"},{\"field\":\"return_deadline\",\"origin\":\"model_default\",\"source_ref\":\"MODEL_DEFAULTS\",\"value\":null}],\"scenario_kind\":\"health_visit\",\"schema_version\":\"0.3.1\",\"scope\":\"origin_stop_presence_to_return_stop_arrival\",\"snapshot_id\":\"official-goierrialdea-go01-health-r5-20260929\",\"sources\":[{\"publisher\":\"Moveuskadi / Goierrialdea\",\"reference_period\":\"2026-09-28/2026-12-27\",\"retrieved_date\":\"2026-09-29\",\"source_id\":\"GTFS\",\"source_role\":\"official_schedule\",\"source_sha256\":\"3276fcae7bfa5002a39a2a094fef6637603de2e50648a46a436b314db27832a4\",\"transformation\":\"R4 normalized GO01 rows, unchanged; approximate stop times, no realtime\",\"url\":\"https://opendata.euskadi.eus/transport/moveuskadi/lurraldebus/goierrialdea/gtfs_goierrialdea.zip\"},{\"publisher\":\"Open Data Euskadi\",\"reference_period\":\"2026-09-20\",\"retrieved_date\":\"2026-09-24\",\"source_id\":\"HEALTH_REGISTRY\",\"source_role\":\"official_health_registry\",\"source_sha256\":\"87a2b8ea3309678ff743e2f267320b94216c3d1e4f52b578bdd0a77bd8bf29ab\",\"transformation\":\"entityBC631DA5 coordinates EPSG:4326\",\"url\":\"https://opendata.euskadi.eus/catalogo/-/centros-de-salud-publicos-en-euskadi/\"},{\"publisher\":\"Osakidetza\",\"reference_period\":\"Observed 2026-09-29\",\"retrieved_date\":\"2026-09-29\",\"source_id\":\"HEALTH_PAGE\",\"source_role\":\"official_health_page\",\"source_sha256\":\"7ba21b4f78f79b55d5761f427582daaef48097245142c9cb259288dc923f3160\",\"transformation\":\"Specific centre name/address/telephone; publication date not stated\",\"url\":\"https://www.osakidetza.euskadi.eus/ambulatorio-de-beasain/webosk00-cercon/es/\"},{\"publisher\":\"Osakidetza\",\"reference_period\":\"2026-01\",\"retrieved_date\":\"2026-09-29\",\"source_id\":\"PADI_2026\",\"source_role\":\"official_health_page\",\"source_sha256\":\"6cf5d40245eb29c9c98785d03aba518c44677104b71625db36c3f2801455ac10\",\"transformation\":\"Page 4 dental consultation listing; address conflict retained\",\"url\":\"https://www.osakidetza.euskadi.eus/contenidos/informacion/salud_padi/es_def/adjuntos/padi-kontsultak-gipuzkoa.pdf\"},{\"publisher\":\"OpenStreetMap contributors\",\"reference_period\":\"Acquired 2026-09-29\",\"retrieved_date\":\"2026-09-29\",\"source_id\":\"OSM\",\"source_role\":\"open_network\",\"source_sha256\":\"0f09edd3324ab4feceddaf0392a33723244404881d3d3efb0a591991ea3df865\",\"transformation\":\"R4 public derivative removes editor/contact metadata; R5 canonicalizes XML line endings to LF for hashing, no geometry change; ODbL 1.0\",\"url\":\"https://api.openstreetmap.org/api/0.6/map?bbox=-2.203,43.041,-2.190,43.052\"},{\"publisher\":\"GIPUZKOA360\",\"reference_period\":\"R5.1\",\"retrieved_date\":\"2026-09-29\",\"source_id\":\"MODEL\",\"source_role\":\"model_parameter\",\"source_sha256\":\"0f3a02e69f8065f892ce19a0115ae7e3c661c32725bd37a423f3d283ae1a2a7d\",\"transformation\":\"ceil(raw total metres/50)*60+120 per complete directed link; each connector <=100 m\",\"url\":null},{\"publisher\":\"GIPUZKOA360 request/calculation\",\"reference_period\":\"2026-09-30\",\"retrieved_date\":null,\"source_id\":\"USER\",\"source_role\":\"user_input\",\"source_sha256\":\"408b4d2510dcd74519f4cbdb198739d7125b5b74081ae6c266570ee49acd6ffd\",\"transformation\":\"Only fields explicitly supplied by the caller; no provider defaults.\",\"url\":null},{\"publisher\":\"GIPUZKOA360 request/calculation\",\"reference_period\":\"2026-09-30\",\"retrieved_date\":null,\"source_id\":\"MODEL_DEFAULTS\",\"source_role\":\"model_parameter\",\"source_sha256\":\"e5f563e38a8c094f01468a02a55f06b560faa668926878fbcc347dfd14a438e3\",\"transformation\":\"Defaults applied by provider_r6; not observed human choices.\",\"url\":null}],\"status\":\"unknown\",\"time_basis\":\"scheduled\",\"walking\":null}","raw_result_sha256":"53a26feba6188515061b3acc43bc2a3f7f09e69cf9b44e1af8b5b3b2646bb3e3","request_id":"OFFLINE_W2_R10_08","schema_version":"1.1.0","status":"error","versions":{"code_sha256":"c9fe7e4c8078ba7f9bf2eb2a51e050b729d9f01e6021dbcc6909f951d2e936e8","contract_sha256":"6fbd22a567cc5a8d8ce17fd1968c52fc92448526bf81103e2768486d724d9ad0","data_sha256":"59fcded9e4236ee094eeb0881c4eb94f521b96fb6c8c89c881c3e9f6d5140901"}}
