{"assumptions":["Horario programado, no observado en tiempo real.","El destino es una parada; no acredita entrada ni visita a centro sanitario."],"capability_id":"plan_visit","claims":[],"effective_request":{"contracts":{"capability":"1.1.0","evidence":"1.1.0","mobility":"0.2.0"},"defaults_applied":["arrival_margin_minutes","boarding_margin_minutes","return_deadline","snapshot_id","timezone","walking_profile_id"],"effective_period":"2026-09-29","municipality_codes":[],"municipality_labels":[],"operation":"plan_visit","parameters":{"appointment_time":"00:30:00","arrival_margin_minutes":10,"boarding_margin_minutes":3,"date":"2026-09-29","destination_id":"beasain_center_stop_pair","duration_minutes":30,"origin_id":"zegama_center_stops","return_deadline":null,"snapshot_id":"official-goierrialdea-go01-r4-20260929","timezone":"Europe/Madrid","walking_profile_id":"stop_only"},"snapshot_id":"official-goierrialdea-go01-r4-20260929"},"error":{"available_options":[],"code":"no_pair_in_complete_direct_search","message":"No hay pareja directa viable en el alcance completo del snapshot","origin":"domain","safe_next_action":"Revise el catálogo y la fecha validada; unknown no demuestra ausencia de transporte."},"execution":{"arguments_sha256":"4dd27ef4970a5fe73b5f7652b4d651c68f63ceda8f5b4c8fd4ad0c80ce0bfbd4","request_id":"OFFLINE_W2_R4_07","snapshot_id":"official-goierrialdea-go01-r4-20260929","state":"completed","tool":"plan_visit"},"limitations":["Solo fecha GO01 validada y scope stop_only; no puerta a puerta, transbordos ni acceso sanitario acreditado."],"method":"W1 0.2.0: búsqueda completa de pares directos programados entre paradas; tiempos modelados y parámetros humanos diferenciados.","normalized_input":{"arguments":{"appointment_time":"00:30","date":"2026-09-29","destination_id":"beasain_center_stop_pair","duration_minutes":30,"origin_id":"zegama_center_stops"},"tool":"plan_visit"},"outcomes":[{"error":{"code":"no_pair_in_complete_direct_search","message":"No hay pareja directa viable en el alcance completo del snapshot"},"index":0,"status":"no_feasible_journey"}],"raw_result_json":"{\"assumptions\":[\"Horarios programados; no incorpora incidencias ni retrasos en tiempo real.\",\"La búsqueda solo contempla viajes directos y paradas declaradas en el catálogo.\",\"Solo embarque y desembarque ordinarios; no se presume reserva ni acuerdo con conductor.\",\"Inicio en parada con margen de embarque; no incluye acceso desde domicilio.\"],\"components\":null,\"components_s\":null,\"error\":{\"code\":\"no_pair_in_complete_direct_search\",\"message\":\"No hay pareja directa viable en el alcance completo del snapshot\"},\"itinerary\":null,\"limitations\":[\"Solo GO01 y viajes directos entre los pares de paradas catalogados.\",\"Los tiempos tienen timepoint=0; son tiempos aproximados/interpolados del feed.\",\"No demuestra un desplazamiento real, puntualidad, accesibilidad universal ni cobertura desde viviendas.\",\"La ausencia de calendar_dates no se interpreta por sí sola como corrupción del GTFS.\",\"Destino piloto en paradas del centro de Beasain; no reproduce el paseo al ambulatorio de la PoC histórica.\"],\"normalized_request\":{\"appointment_time\":\"00:30:00\",\"arrival_margin_minutes\":10,\"boarding_margin_minutes\":3,\"date\":\"2026-09-29\",\"destination_id\":\"beasain_center_stop_pair\",\"duration_minutes\":30,\"origin_id\":\"zegama_center_stops\",\"return_deadline\":null,\"snapshot_id\":\"official-goierrialdea-go01-r4-20260929\",\"timezone\":\"Europe/Madrid\",\"walking_profile_id\":\"stop_only\"},\"scenario_kind\":\"stop_only\",\"schema_version\":\"0.2.0\",\"scope\":\"origin_stop_presence_to_return_stop_arrival\",\"snapshot_id\":\"official-goierrialdea-go01-r4-20260929\",\"sources\":[{\"classification\":\"OFFICIAL\",\"feed_version\":\"20260928054818\",\"index_last_update\":\"2026-09-29 07:01:13\",\"index_url\":\"https://opendata.euskadi.eus/transport/moveuskadi/data-index-gtfs.json\",\"operator_feed\":\"Lurraldebus Goierrialdea\",\"publisher\":\"Gobierno Vasco / Moveuskadi\",\"retrieved_date\":\"2026-09-29\",\"source_id\":\"MOVEUSKADI_GOIERRIALDEA_3276fcae7bfa\",\"source_sha256\":\"3276fcae7bfa5002a39a2a094fef6637603de2e50648a46a436b314db27832a4\",\"url\":\"https://opendata.euskadi.eus/transport/moveuskadi/lurraldebus/goierrialdea/gtfs_goierrialdea.zip\"}],\"status\":\"no_feasible_journey\",\"time_basis\":\"scheduled\"}","raw_result_sha256":"aa2203f78d10c0acb51672fe000a2e4751bbed36385a102dccdfce786c6bf18b","request_id":"OFFLINE_W2_R4_07","schema_version":"1.1.0","status":"no_data","versions":{"code_sha256":"c97842617f3077c2eec1892653361b4471a18e1c64f8127b808b9968401cb834","contract_sha256":"6fbd22a567cc5a8d8ce17fd1968c52fc92448526bf81103e2768486d724d9ad0","data_sha256":"62e00c04edb96ccde0a5ce4fe81574452ddcacdb4c173b030ca49b000f5a084b"}}
