{"assumptions":[],"capability_id":"consultar_fuente","claims":[],"effective_request":null,"error":{"available_options":["EUSTAT_EMH_2025","ODE_HEALTH_CENTRES_2026","GEOEUSKADI_MUNICIPIOS_2025","G360_DERIVED_MUNICIPAL_METRICS_V1"],"code":"source_not_found","message":"No hay metadatos para TEST_FALSE_SOURCE.","origin":"domain","safe_next_action":"Revisar los valores disponibles; si el fallo persiste, no usar el resultado."},"execution":{"arguments_sha256":"c3bc9a55905af773a3df9b0d807bed2b9f372342393e1fcf5a0f564e99810886","request_id":"OFFLINE_W2_R10_04","snapshot_id":null,"state":"completed","tool":"consultar_fuente"},"limitations":[],"method":"","normalized_input":{"arguments":{"source_id":"TEST_FALSE_SOURCE"},"tool":"consultar_fuente"},"outcomes":[],"raw_result_json":"{\"available_options\":[\"EUSTAT_EMH_2025\",\"ODE_HEALTH_CENTRES_2026\",\"GEOEUSKADI_MUNICIPIOS_2025\",\"G360_DERIVED_MUNICIPAL_METRICS_V1\"],\"error_code\":\"source_not_found\",\"message\":\"No hay metadatos para TEST_FALSE_SOURCE.\",\"status\":\"error\"}","raw_result_sha256":"dc621011503e82788ebe42df88ce60791bf8a91262656a93161a0adb18be35e9","request_id":"OFFLINE_W2_R10_04","schema_version":"1.1.0","status":"error","versions":{"code_sha256":"d99354c46a62679c80a64e8f0b8d22a5486608f8caf775fd830af19a91ce966f","contract_sha256":"6fbd22a567cc5a8d8ce17fd1968c52fc92448526bf81103e2768486d724d9ad0","data_sha256":"45c28e3e606821ee7738d67066c6bb9291a0e75f8fdace6ca44809cc46e20468"}}
