{"assumptions":[],"capability_id":"analizar_envejecimiento","claims":[],"effective_request":null,"error":{"available_options":[],"code":"invalid_arguments","message":"arguments:grupo_edad:invalid_value","origin":"domain","safe_next_action":"Revisar los valores disponibles; si el fallo persiste, no usar el resultado."},"execution":{"arguments_sha256":"3df7d7b49bf88b11da87c63ade868582090b0c734cd4ac3245594e2b2e5a0eed","request_id":"OFFLINE_W2_R4_03","snapshot_id":null,"state":"failed","tool":"analizar_envejecimiento"},"limitations":[],"method":"","normalized_input":{"arguments":{"grupo_edad":"70"},"tool":"analizar_envejecimiento"},"outcomes":[],"raw_result_json":null,"raw_result_sha256":null,"request_id":"OFFLINE_W2_R4_03","schema_version":"1.1.0","status":"error","versions":{"code_sha256":"6223c9f1a8ccf9e812d5b253e5e11b7b95aa2d6acb2091cc4bd6dd88d656b5b1","contract_sha256":"6fbd22a567cc5a8d8ce17fd1968c52fc92448526bf81103e2768486d724d9ad0","data_sha256":"8a469976641f39917e14aad14b614609e7b97e9034133da93334509dced2c2ac"}}
